STATION CODE,LOCATIONS,STATE,TEMPERATURE ºC : Min,TEMPERATURE ºC : Max,TEMPERATURE ºC : Mean,pH : Min : 6.5-8.5,pH : Max : 6.5-8.5,pH : Mean : 6.5-8.5,CONDUCTIVITY (µmhos/cm) : Min,CONDUCTIVITY (µmhos/cm) : Max,CONDUCTIVITY (µmhos/cm) : Mean,B.O.D. (mg/l) : Min : < 3 mg/l,B.O.D. (mg/l) : Max : < 3 mg/l,B.O.D. (mg/l) : Mean : < 3 mg/l,NITRATE- N+ NITRITE-N (mg/l) : Min,NITRATE- N+ NITRITE-N (mg/l) : Max,NITRATE- N+ NITRITE-N (mg/l) : Mean,FECAL COLIFORM (MPN/100ml) : Min : < 2500 MPN/100ml,FECAL COLIFORM (MPN/100ml) : Max : < 2500 MPN/100ml,FECAL COLIFORM (MPN/100ml) : Mean : < 2500 MPN/100ml,TOTAL COLIFORM (MPN/100ml) : Min : < 5000 MPN/100ml,TOTAL COLIFORM (MPN/100ml) : Max : < 5000 MPN/100ml,TOTAL COLIFORM (MPN/100ml) : Mean : < 5000 MPN/100ml
2277,WELL AT VERNA INDI.ESTATE.(M/S CIPLA LIMITED),Goa,31.8,32,31.9,6.9,7,7,250,1486,868,0.6,0.8,0.7,0,1.3,0.7,5,5,5,11,11,11
2278,WELL AT SANCOALE INDL.ESTATE,Goa,29,31.6,30.3,6.2,7.3,6.7,94,1439,767,0.6,0.7,0.7,0.1,1.1,0.6,17,17,17,33,33,33
2279,"WELL AT ZUARI INDUSTRIES LTD, ZUARI NAGAR",Goa,30,30,30,6.8,6.8,6.8,1542,1542,1542,1.5,1.5,1.5,0.1,0.1,0.1,NA,NA,NA,NA,NA,NA
2280,WELL AT KUDAI INDL. ESTATE(M/S CADILA HEALTHCARE LIMITED),Goa,29.7,31,30.4,6.1,6.6,6.3,208,1479,844,0.1,1.6,0.9,1.1,3.5,2.3,NA,NA,NA,NA,NA,NA
2281,WELL AT CORLIM INDL. ESTATE,Goa,28.5,30,29.3,5.4,6.1,5.8,45,1420,733,0.2,1.1,0.7,0.1,0.3,0.2,23,49,36,79,170,125
2282,WELL AT PILERNE INDUSTRIAL ESTATE(M/S UNICHEM ),Goa,31,31.6,31.3,5.9,7,6.4,155,1497,826,0.2,0.3,0.3,0.3,1.2,0.7,23,23,23,79,79,79
3193,BORE WELL AT CUNCOLIM INDUSTRIAL ESTATE,Goa,29.2,32.2,30.7,7,7,7,14,328,171,0.1,3,1.6,0,0.2,0.1,2,13,8,13,33,23
3194,BORE WELL AT BETHORA INDUSTRIAL ESTATE,Goa,30,31,30.5,5.5,6.9,6.2,83,1429,756,0.7,1.6,1.2,0.9,1.4,1.2,8,8,8,17,17,17
3195,BORE WELL AT MADKAIM INDUSTRIAL ESTATE,Goa,31.5,31.6,31.6,6.7,7.9,7.3,253,1404,829,0.9,1.5,1.2,0.1,1.5,0.8,240,240,240,540,540,540
